{
  "domain": "cim-graph",
  "version": "2.0.0",
  "generated_from": "event-storming-session.md",
  "timestamp": "2025-08-05T09:45:00-07:00",
  
  "aggregates": {
    "Graph": {
      "id": "aggregate_id",
      "description": "Core graph aggregate for all graph operations",
      "commands": [
        {
          "name": "InitializeGraph",
          "produces": "GraphInitialized",
          "parameters": {
            "aggregate_id": "UUID",
            "graph_type": "GraphType",
            "metadata": "Map<String, Value>"
          }
        },
        {
          "name": "AddNode",
          "produces": "NodeAdded",
          "parameters": {
            "node_id": "String",
            "node_type": "String",
            "data": "JSON"
          }
        },
        {
          "name": "AddEdge",
          "produces": "EdgeAdded",
          "parameters": {
            "edge_id": "String",
            "source_id": "String",
            "target_id": "String",
            "edge_type": "String",
            "data": "JSON"
          }
        },
        {
          "name": "RemoveNode",
          "produces": "NodeRemoved",
          "parameters": {
            "node_id": "String"
          }
        },
        {
          "name": "RemoveEdge",
          "produces": "EdgeRemoved",
          "parameters": {
            "edge_id": "String"
          }
        }
      ],
      "events": [
        {
          "name": "GraphInitialized",
          "data": {
            "aggregate_id": "UUID",
            "graph_type": "GraphType",
            "metadata": "Map<String, Value>"
          }
        },
        {
          "name": "NodeAdded",
          "data": {
            "node_id": "String",
            "node_type": "String",
            "data": "JSON"
          }
        },
        {
          "name": "EdgeAdded",
          "data": {
            "edge_id": "String",
            "source_id": "String",
            "target_id": "String",
            "edge_type": "String",
            "data": "JSON"
          }
        },
        {
          "name": "NodeRemoved",
          "data": {
            "node_id": "String"
          }
        },
        {
          "name": "EdgeRemoved",
          "data": {
            "edge_id": "String"
          }
        }
      ],
      "invariants": [
        "Nodes must exist before edges can connect them",
        "Graph type cannot change after initialization",
        "All changes must go through state machine"
      ],
      "state_machine": {
        "states": [
          "Uninitialized",
          "Initialized",
          "Active",
          "Archived"
        ],
        "transitions": [
          {
            "from": "Uninitialized",
            "to": "Initialized",
            "via": "InitializeGraph"
          },
          {
            "from": "Initialized",
            "to": "Active",
            "via": "AddNode"
          },
          {
            "from": "Active",
            "to": "Active",
            "via": ["AddNode", "AddEdge", "RemoveNode", "RemoveEdge"]
          },
          {
            "from": "Active",
            "to": "Archived",
            "via": "ArchiveGraph"
          }
        ]
      }
    },
    
    "IPLDChain": {
      "id": "root_cid",
      "description": "IPLD chain for content-addressed event storage",
      "commands": [
        {
          "name": "AddCID",
          "produces": "CIDGenerated",
          "parameters": {
            "event_id": "UUID",
            "payload": "EventData"
          }
        },
        {
          "name": "LinkCIDs",
          "produces": "CIDLinked",
          "parameters": {
            "current_cid": "CID",
            "previous_cid": "CID"
          }
        },
        {
          "name": "PinCID",
          "produces": "CIDPinned",
          "parameters": {
            "cid": "CID"
          }
        },
        {
          "name": "VerifyChain",
          "produces": "ChainVerified",
          "parameters": {
            "root_cid": "CID"
          }
        }
      ],
      "events": [
        {
          "name": "CIDGenerated",
          "data": {
            "event_id": "UUID",
            "cid": "CID",
            "payload_size": "Integer"
          }
        },
        {
          "name": "CIDLinked",
          "data": {
            "current_cid": "CID",
            "previous_cid": "CID",
            "sequence": "Integer"
          }
        },
        {
          "name": "CIDPinned",
          "data": {
            "cid": "CID",
            "pinned_at": "DateTime"
          }
        },
        {
          "name": "CIDUnpinned",
          "data": {
            "cid": "CID",
            "unpinned_at": "DateTime"
          }
        },
        {
          "name": "ChainValidated",
          "data": {
            "root_cid": "CID",
            "chain_length": "Integer",
            "is_valid": "Boolean"
          }
        }
      ],
      "invariants": [
        "CIDs are immutable",
        "Links form DAG (no cycles)",
        "Previous CID must exist"
      ]
    },
    
    "Projection": {
      "id": "aggregate_id_version",
      "description": "Read-only projections built from event streams",
      "commands": [
        {
          "name": "BuildProjection",
          "produces": "ProjectionBuilt",
          "parameters": {
            "aggregate_id": "UUID",
            "from_version": "Integer",
            "to_version": "Integer"
          }
        },
        {
          "name": "CacheProjection",
          "produces": "ProjectionCached",
          "parameters": {
            "aggregate_id": "UUID",
            "version": "Integer"
          }
        },
        {
          "name": "InvalidateCache",
          "produces": "CacheInvalidated",
          "parameters": {
            "aggregate_id": "UUID"
          }
        }
      ],
      "events": [
        {
          "name": "ProjectionBuilt",
          "data": {
            "aggregate_id": "UUID",
            "version": "Integer",
            "event_count": "Integer"
          }
        },
        {
          "name": "ProjectionCached",
          "data": {
            "aggregate_id": "UUID",
            "version": "Integer",
            "cache_key": "String"
          }
        },
        {
          "name": "CacheInvalidated",
          "data": {
            "aggregate_id": "UUID",
            "reason": "String"
          }
        }
      ],
      "invariants": [
        "Projections are read-only",
        "Version matches event sequence",
        "Built from complete event stream"
      ]
    }
  },
  
  "entities": {
    "Node": {
      "description": "Graph node entity",
      "properties": {
        "id": "String (CID for IPLD, UUID for others)",
        "components": "HashMap<String, Value>"
      },
      "belongs_to": "Graph"
    },
    "Edge": {
      "description": "Graph edge entity",
      "properties": {
        "id": "String",
        "source": "Node ID",
        "target": "Node ID",
        "components": "HashMap<String, Value>"
      },
      "belongs_to": "Graph"
    },
    "EventPayload": {
      "description": "IPLD event payload",
      "properties": {
        "cid": "CID",
        "data": "Serialized event data",
        "previous": "Optional<CID>"
      },
      "belongs_to": "IPLDChain"
    }
  },
  
  "value_objects": {
    "CID": {
      "description": "Content Identifier",
      "properties": {
        "hash": "String",
        "codec": "String"
      },
      "immutable": true
    },
    "GraphType": {
      "description": "Type of graph",
      "enum": ["Generic", "IPLD", "Context", "Workflow", "Concept", "Composed"],
      "immutable": true
    },
    "ComponentData": {
      "description": "Component data for ECS",
      "properties": {
        "type": "String",
        "value": "JSON"
      },
      "immutable": true
    },
    "StateTransition": {
      "description": "State machine transition",
      "properties": {
        "from": "State",
        "to": "State",
        "trigger": "Command"
      },
      "immutable": true
    }
  },
  
  "policies": {
    "CIDGenerationPolicy": {
      "trigger": "Any Event Created",
      "action": "Generate CID from event payload",
      "rules": [
        "Use cim-ipld for generation",
        "Include previous CID if exists",
        "Store in event metadata"
      ]
    },
    "ProjectionUpdatePolicy": {
      "trigger": "Event Published",
      "action": "Update affected projections",
      "rules": [
        "Only update projections for same aggregate",
        "Maintain version consistency",
        "Invalidate caches"
      ]
    },
    "StateValidationPolicy": {
      "trigger": "Command Received",
      "action": "Validate against current state",
      "rules": [
        "Check state machine rules",
        "Verify invariants",
        "Return error if invalid"
      ]
    },
    "ChainValidationPolicy": {
      "trigger": "CID Chain Modified",
      "action": "Verify chain integrity",
      "rules": [
        "All CIDs must be valid",
        "Links must form DAG",
        "Previous references must exist"
      ]
    },
    "CollaborationPolicy": {
      "trigger": "Client Subscribed",
      "action": "Replay events from sequence",
      "rules": [
        "Start from client's last known sequence",
        "Send in order",
        "Include all metadata"
      ]
    }
  },
  
  "bounded_contexts": {
    "GraphContext": {
      "name": "Graph Context",
      "aggregates": ["Graph"],
      "entities": ["Node", "Edge"],
      "commands": ["GraphCommand"],
      "events": ["GraphEvent"],
      "projections": ["GraphProjection"]
    },
    "IPLDContext": {
      "name": "IPLD Context",
      "aggregates": ["IPLDChain"],
      "entities": ["EventPayload"],
      "policies": ["CIDGenerationPolicy"],
      "relationships": {
        "upstream_to": ["GraphContext"]
      }
    },
    "StateMachineContext": {
      "name": "State Machine Context",